{
  "id": "secret-frequency",
  "name": "Secret Frequency",
  "dateAdded": "2025-11-25T12:12:56.000Z",
  "dateUpdated": null,
  "disclosure": "none",
  "disclosureNotes": null,
  "disclosureTypes": [],
  "markers": [],
  "markerNotes": "AI generated youtube visuals, no band photos, prolific song releases.",
  "genres": [],
  "popularity": null,
  "followers": null,
  "shScore": null,
  "spotify": "01znV3xwZz9Tf6O4ngKA0o",
  "apple": "1829150764",
  "amazon": null,
  "youtube": "@SecretFrequencyVibes",
  "tiktok": null,
  "instagram": null
}
