{
  "id": "sol",
  "name": "Sol.",
  "dateAdded": "2025-12-07T22:33:18.000Z",
  "dateUpdated": null,
  "disclosure": "none",
  "disclosureNotes": null,
  "disclosureTypes": [],
  "markers": [
    "anonymous",
    "high-output"
  ],
  "markerNotes": null,
  "genres": [],
  "popularity": null,
  "followers": null,
  "shScore": null,
  "spotify": "06bsQwVfa3ysH7MH2b3N6p",
  "apple": "1845570347",
  "amazon": "B07LGRKG3P",
  "youtube": null,
  "tiktok": null,
  "instagram": null
}
