{
  "id": "runas-da-graca",
  "name": "Runas da Graça",
  "dateAdded": "2025-12-22T13:18:22.000Z",
  "dateUpdated": null,
  "disclosure": "none",
  "disclosureNotes": null,
  "disclosureTypes": [],
  "markers": [
    "ai-visuals",
    "anonymous",
    "high-output"
  ],
  "markerNotes": "Viking-themed Brazilian/Portuguese Christian songs.",
  "genres": [],
  "popularity": null,
  "followers": null,
  "shScore": null,
  "spotify": "1KrlNbJ7uQ6hhmiKNO5I3H",
  "apple": null,
  "amazon": "B0G267PX4N",
  "youtube": "@MusicaCristãcomIA",
  "tiktok": "@runasdagraca",
  "instagram": "runasdagraca"
}
