{
  "id": "fallen-jay",
  "name": "Fallen Jay",
  "dateAdded": "2026-02-08T22:17:10.103Z",
  "dateUpdated": null,
  "disclosure": "confirmed",
  "disclosureNotes": "The description on this song https://youtube.com/watch?v=_yFDhsBfexU states: \"AI tools were used in the creation of this song.\"",
  "disclosureTypes": [],
  "markers": [
    "2024-onwards",
    "ai-visuals",
    "anonymous",
    "high-output"
  ],
  "markerNotes": null,
  "genres": [],
  "popularity": null,
  "followers": null,
  "shScore": null,
  "spotify": "5TVDljK6HLwuV0Z1QtWd5Y",
  "apple": "1837136824",
  "amazon": "B0DR28CL6G",
  "youtube": "UC2VKwoD53YVJsoWPVxIUivw",
  "tiktok": "@fallenjay_official",
  "instagram": "fallenjay_official"
}
