{
  "id": "voxen-soundworks",
  "name": "Voxen Soundworks",
  "dateAdded": "2026-01-03T19:09:27.000Z",
  "dateUpdated": null,
  "disclosure": "none",
  "disclosureNotes": null,
  "disclosureTypes": [],
  "markers": [
    "ai-visuals",
    "anonymous"
  ],
  "markerNotes": "No information about this artist is available online. All albums on Apple Music were released in 2025, with artwork consistent with typical AI-generated projects.",
  "genres": [],
  "popularity": null,
  "followers": null,
  "shScore": null,
  "spotify": "4rqAQj8Im18ldiYOrp1kgK",
  "apple": "1827481576",
  "amazon": "B0FHWSX692",
  "youtube": "UCNV-PT2JzRJGWzNTpWPwSYg",
  "tiktok": null,
  "instagram": null
}
