{
  "id": "beyond-disdain",
  "name": "Beyond Disdain",
  "dateAdded": "2025-11-25T12:12:56.000Z",
  "dateUpdated": null,
  "disclosure": "none",
  "disclosureNotes": null,
  "disclosureTypes": [],
  "markers": [],
  "markerNotes": null,
  "genres": [],
  "popularity": null,
  "followers": null,
  "shScore": null,
  "spotify": "2MpVNPYFczBeNjPXePyVB4",
  "apple": "1828078019",
  "amazon": null,
  "youtube": null,
  "tiktok": null,
  "instagram": null
}
