{
  "id": "breaking-rust",
  "name": "Breaking Rust",
  "dateAdded": "2025-11-28T10:56:37.000Z",
  "dateUpdated": null,
  "disclosure": "none",
  "disclosureNotes": null,
  "disclosureTypes": [],
  "markers": [],
  "markerNotes": null,
  "genres": [],
  "popularity": null,
  "followers": null,
  "shScore": null,
  "spotify": "3h9rLaviiFj1TeEhdIRpP5",
  "apple": "1845441331",
  "amazon": null,
  "youtube": "UCODbKiVoR8lWDPl39uf803Q",
  "tiktok": null,
  "instagram": "breakinrust"
}
