{
  "id": "photoserge",
  "name": "Photoserge",
  "dateAdded": "2026-01-15T20:02:37.301Z",
  "dateUpdated": null,
  "disclosure": "none",
  "disclosureNotes": null,
  "disclosureTypes": [],
  "markers": [
    "ai-visuals"
  ],
  "markerNotes": null,
  "genres": [],
  "popularity": null,
  "followers": null,
  "shScore": null,
  "spotify": "2onKmM2RXRYy9TOa6ZWUxw",
  "apple": "1835129616",
  "amazon": null,
  "youtube": "@photoserge",
  "tiktok": null,
  "instagram": null
}
