{
  "id": "veyna-ashford",
  "name": "Veyna Ashford",
  "dateAdded": "2025-12-15T11:35:28.000Z",
  "dateUpdated": null,
  "disclosure": "partial",
  "disclosureNotes": null,
  "disclosureTypes": [],
  "markers": [],
  "markerNotes": null,
  "genres": [],
  "popularity": null,
  "followers": null,
  "shScore": null,
  "spotify": "1GsWRG8DFVvi4xMUoAYB4h",
  "apple": "1799612271",
  "amazon": "B0DZ22VCFV",
  "youtube": "UC9MoaW-ig2q3ftE7p9_EbNw",
  "tiktok": "@veyna.ashford",
  "instagram": "veyna.ashford"
}
