{
  "id": "soundsofenigma",
  "name": "SoundsOfEnigma",
  "dateAdded": "2026-02-08T22:11:38.166Z",
  "dateUpdated": null,
  "disclosure": "none",
  "disclosureNotes": null,
  "disclosureTypes": [],
  "markers": [
    "2024-onwards",
    "ai-visuals",
    "anonymous",
    "high-output"
  ],
  "markerNotes": null,
  "genres": [],
  "popularity": null,
  "followers": null,
  "shScore": null,
  "spotify": "4QcAAh9FC9Dk9QhJga0wsz",
  "apple": "1830886194",
  "amazon": "B0FL1LL6K4",
  "youtube": "UCFsBvLzU4VARppfRbvtHoZQ",
  "tiktok": "@soundsofenigma",
  "instagram": null
}
