{
  "id": "conaco",
  "name": "conaco",
  "dateAdded": "2026-01-24T19:45:22.287Z",
  "dateUpdated": null,
  "disclosure": "none",
  "disclosureNotes": null,
  "disclosureTypes": [],
  "markers": [
    "ai-visuals",
    "anonymous",
    "high-output"
  ],
  "markerNotes": null,
  "genres": [],
  "popularity": null,
  "followers": null,
  "shScore": null,
  "spotify": "318pAc7ymkSe2l4EIzPINf",
  "apple": "1763484498",
  "amazon": "B0DDFFMFKX",
  "youtube": "UCNmdmg-uq3Jl3Cqay0-8kDw",
  "tiktok": null,
  "instagram": null
}
