{
  "id": "miyunique",
  "name": "Miyunique",
  "dateAdded": "2026-01-14T10:06:48.143Z",
  "dateUpdated": null,
  "disclosure": "none",
  "disclosureNotes": null,
  "disclosureTypes": [],
  "markers": [
    "ai-visuals",
    "anonymous"
  ],
  "markerNotes": null,
  "genres": [],
  "popularity": null,
  "followers": null,
  "shScore": null,
  "spotify": "3eEhSN0SxKi7o2z3S2hCZh",
  "apple": "1815605733",
  "amazon": "B0F989D4KN",
  "youtube": "@miyunique",
  "tiktok": "@miyunique_official",
  "instagram": "miyunique_official"
}
