{
  "id": "icy-mattrix",
  "name": "Icy Mattrix",
  "dateAdded": "2026-01-14T17:03:34.386Z",
  "dateUpdated": null,
  "disclosure": "none",
  "disclosureNotes": null,
  "disclosureTypes": [],
  "markers": [
    "ai-visuals",
    "anonymous",
    "inconsistent-style"
  ],
  "markerNotes": null,
  "genres": [],
  "popularity": null,
  "followers": null,
  "shScore": null,
  "spotify": "68836SJE8W22kbI9RG8oUT",
  "apple": "1412174757",
  "amazon": "B07FK63R38",
  "youtube": "@icymattrixmusic",
  "tiktok": "@icymattrixmusic",
  "instagram": "icymattrixmusic"
}
