{
  "id": "the-bardic-dm",
  "name": "The Bardic DM",
  "dateAdded": "2025-12-02T17:03:39.000Z",
  "dateUpdated": "2026-01-14T09:58:17.222Z",
  "disclosure": "partial",
  "disclosureNotes": "The YouTube bio states that they produce \"custom AI-generated songs inspired by classic campaign fails.\"",
  "disclosureTypes": [],
  "markers": [
    "ai-visuals",
    "high-output"
  ],
  "markerNotes": null,
  "genres": [],
  "popularity": null,
  "followers": null,
  "shScore": null,
  "spotify": "0TVQlzIjzD4ToSVeXIB15H",
  "apple": "1841870377",
  "amazon": "B0FSF73BMS",
  "youtube": "UCoBW7TQnbEh70NjWXhg8g7g",
  "tiktok": null,
  "instagram": null
}
