{
  "id": "anna-regina",
  "name": "Anna Regina",
  "dateAdded": "2025-12-18T18:55:46.000Z",
  "dateUpdated": null,
  "disclosure": "partial",
  "disclosureNotes": null,
  "disclosureTypes": [],
  "markers": [],
  "markerNotes": "YouTube description acknowledges use of AI (AI vocal enhancements). Mostly cover songs.",
  "genres": [],
  "popularity": null,
  "followers": null,
  "shScore": null,
  "spotify": "68apaJ2x3O9QarUZkSUiiS",
  "apple": "1844158986",
  "amazon": "B0FNFK94H6",
  "youtube": "UCrtsfoEp4CmtK9L8uB2NeQg",
  "tiktok": null,
  "instagram": null
}
