{
  "id": "white-girl",
  "name": "White Girl",
  "dateAdded": "2026-02-05T20:48:33.471Z",
  "dateUpdated": null,
  "disclosure": "none",
  "disclosureNotes": null,
  "disclosureTypes": [],
  "markers": [
    "high-output",
    "anonymous",
    "ai-visuals",
    "2024-onwards"
  ],
  "markerNotes": "Since inception, the channel posts hour-long compilations every few days.",
  "genres": [],
  "popularity": null,
  "followers": null,
  "shScore": null,
  "spotify": "3rGoJRnuqqkPP9Q84GxsAa",
  "apple": "1775579422",
  "amazon": null,
  "youtube": "UC4BuevD8hFpRxdoZh39mQcQ",
  "tiktok": null,
  "instagram": null
}
