{
  "id": "fable0x",
  "name": "Fable0x",
  "dateAdded": "2025-12-21T20:47:19.000Z",
  "dateUpdated": null,
  "disclosure": "none",
  "disclosureNotes": null,
  "disclosureTypes": [],
  "markers": [],
  "markerNotes": "Acknowledges they are AI-generated in their Discord.",
  "genres": [],
  "popularity": null,
  "followers": null,
  "shScore": null,
  "spotify": "4YvG2DXblKm8bHp8MHkJj7",
  "apple": "1781327584",
  "amazon": "B0DNV8W1J9",
  "youtube": "@Fable0x",
  "tiktok": "@fable0x",
  "instagram": "fable0x"
}
