{
  "id": "velcheva-vibe",
  "name": "VELCHEVA VIBE",
  "dateAdded": "2026-02-05T14:36:19.894Z",
  "dateUpdated": null,
  "disclosure": "none",
  "disclosureNotes": null,
  "disclosureTypes": [],
  "markers": [
    "2024-onwards",
    "ai-visuals",
    "anonymous"
  ],
  "markerNotes": null,
  "genres": [],
  "popularity": null,
  "followers": null,
  "shScore": null,
  "spotify": "2YS32rdok3MAzXbgIlZzzl",
  "apple": "1861732439",
  "amazon": null,
  "youtube": "UCyDntyiDcta8FUtjhP2s4YQ",
  "tiktok": null,
  "instagram": null
}
