{
  "id": "intimate-vibes",
  "name": "Intimate Vibes",
  "dateAdded": "2026-01-13T20:50:38.682Z",
  "dateUpdated": null,
  "disclosure": "none",
  "disclosureNotes": null,
  "disclosureTypes": [],
  "markers": [
    "ai-visuals",
    "anonymous",
    "high-output"
  ],
  "markerNotes": null,
  "genres": [],
  "popularity": null,
  "followers": null,
  "shScore": null,
  "spotify": "0m2ZWklF7gejc0Q9GzxACb",
  "apple": "1823929917",
  "amazon": "B0FG8ZFBS6",
  "youtube": "UCPzwot91OpxPs439NSneQ4g",
  "tiktok": null,
  "instagram": null
}
