{
  "id": "biodrive",
  "name": "Biodrive",
  "dateAdded": "2025-12-03T22:59:59.000Z",
  "dateUpdated": null,
  "disclosure": "none",
  "disclosureNotes": null,
  "disclosureTypes": [],
  "markers": [],
  "markerNotes": null,
  "genres": [],
  "popularity": null,
  "followers": null,
  "shScore": null,
  "spotify": "1Xj8Qf3AK2KBn7AF98OC78",
  "apple": "1729131424",
  "amazon": "B07MJRT463",
  "youtube": null,
  "tiktok": null,
  "instagram": null
}
